post,tags
Visa Purchase WOOLWORTHS Darling Heights,Grocery
Visa Purchase WOOLWORTHS Brisbane,Grocery
Visa Purchase WOOLWORTHS melbourne,Grocery
Visa Purchase WOOLWORTHS sydney,Grocery
Visa Purchase WOOLWORTHS singapore,Grocery
Visa Purchase WOOLWORTHS Adelaide,Grocery
Visa Purchase WOOLWORTHS Toowoomba,Grocery
Visa Purchase WOOLWORTHS Dalby,Grocery
Visa Purchase WOOLWORTHS Morayfield,Grocery
Visa Purchase 7 Eleven Darling Heights,Transport
Visa Purchase 7 Eleven Brisbane,Transport
Visa Purchase 7 Eleven melbourne,Transport
Visa Purchase 7 Eleven sydney,Transport
Visa Purchase 7 Eleven singapore,Transport
Visa Purchase 7 Eleven Adelaide,Transport
Visa Purchase 7 Eleven Toowoomba,Transport
Visa Purchase 7 Eleven Dalby,Transport
Visa Purchase 7 Eleven Morayfield,Transport
Visa Purchase McDonalds Darling Heights,Food and Drinks
Visa Purchase McDonalds Brisbane,Food and Drinks
Visa Purchase McDonalds melbourne,Food and Drinks
Visa Purchase McDonalds sydney,Food and Drinks
Visa Purchase McDonalds singapore,Food and Drinks
Visa Purchase McDonalds Adelaide,Food and Drinks
Visa Purchase McDonalds Toowoomba,Food and Drinks
Visa Purchase McDonalds Dalby,Food and Drinks
Visa Purchase McDonalds Morayfield,Food and Drinks
Master Card Purchase coles Toowoomba,Grocery
Master Card Purchase Uber Eats,Food and Drinks
Master Card Priceline Pharmacy Springfield,Health
Visa Purchase Priceline Pharmacy Gold Coast,Health
Visa Purchase Priceline Pharmacy Toowoomba,Health
Visa Purchase Toto Cafe Goondiwindi,Food and Drinks
Visa Purchase Coles Dalby,Grocery
